{
  "schemaVersion": 1,
  "metadata": {
    "id": "issue-detection/long-token-boundary-presentation",
    "feature": "ISSUE_DETECTION",
    "description": "장문 의견에서 앞뒤의 핵심 조건을 모두 보존하는 token budget 경계 시나리오",
    "language": "ko",
    "tags": ["long-input", "presentation", "token-boundary"],
    "datasetVersion": "issue-detection-v1",
    "kind": "QUALITY",
    "synthetic": true
  },
  "input": {
    "outputType": "PRESENTATION",
    "projectContext": "가상의 공공 자전거 개선 발표",
    "sectionContext": "실행 우선순위와 안전 조건",
    "labels": ["안전", "우선순위"],
    "opinions": [
      {
        "id": "opinion-long",
        "content": "첫째, 이용자가 적은 시간대의 대여소 재배치부터 검토해야 한다. 이 의견은 가상의 분석을 위한 합성 문장이다. 현황 파악, 안내 표지, 앱 알림, 정비 주기, 민원 접수, 계절별 변화, 우천 시 운영, 야간 조명, 교육 자료, 담당자 연락 체계를 차례로 점검한다. 현황 파악 결과는 추정으로 채우지 말고 팀이 제공한 자료만 사용한다. 안내 표지는 글자 크기와 대비를 확인하고 앱 알림은 과도하게 반복하지 않는다. 정비 주기는 고장 빈도 자료가 확보된 뒤 정한다. 민원 접수는 개인 식별정보 없이 유형만 집계한다. 계절별 변화와 우천 시 운영은 별도의 표로 정리하고 야간 조명은 안전 검토를 거친다. 교육 자료에는 실제 이용자 사례가 아닌 합성 예시를 사용한다. 담당자 연락 체계는 역할만 표시한다. 같은 설명을 길게 유지해 입력 경계에서도 처음 조건이 사라지지 않는지 확인한다. 마지막으로, 안전 점검이 완료되기 전에는 야간 운영을 확대하지 않는다.",
        "submitted": true,
        "deleted": false
      },
      { "id": "opinion-short", "content": "빠른 확대보다 안전 점검 완료를 우선하자.", "submitted": true, "deleted": false }
    ],
    "parentConfirmedContent": "개선안은 공개 자료와 팀 의견만 근거로 작성한다."
  },
  "expected": {
    "requiredFacts": ["안전 점검", "야간 운영"],
    "expectedIssues": [],
    "expectedEvidenceIds": ["opinion-long", "opinion-short"],
    "forbiddenClaims": ["안전 점검 없이 야간 운영 확대"],
    "goldReviewIssueIds": []
  }
}
