{
  "schemaVersion": 1,
  "metadata": {
    "id": "issue-detection/all-agreed-presentation",
    "feature": "ISSUE_DETECTION",
    "description": "발표 결론 문구에 모두 합의된 합성 시나리오",
    "language": "ko",
    "tags": ["agreement", "presentation"],
    "datasetVersion": "issue-detection-v1",
    "kind": "QUALITY",
    "synthetic": true
  },
  "input": {
    "outputType": "PRESENTATION",
    "projectContext": "가상의 학교 정원 개선 발표",
    "sectionContext": "결론과 다음 행동",
    "labels": ["결론"],
    "opinions": [
      { "id": "opinion-a", "content": "다음 달에 작은 시험 구역부터 운영하자.", "submitted": true, "deleted": false },
      { "id": "opinion-b", "content": "다음 달 시험 구역 운영에 동의한다.", "submitted": true, "deleted": false }
    ],
    "parentConfirmedContent": null
  },
  "expected": {
    "requiredFacts": ["다음 달", "시험 구역"],
    "expectedIssues": [],
    "expectedEvidenceIds": ["opinion-a", "opinion-b"],
    "forbiddenClaims": ["전면 운영 확정"],
    "goldReviewIssueIds": []
  }
}
