{
  "schemaVersion": 1,
  "metadata": {
    "id": "issue-detection/missing-information-gap-proposal",
    "feature": "ISSUE_DETECTION",
    "description": "필수 예산 총액이 없는 GAP 합성 시나리오",
    "language": "ko",
    "tags": ["gap", "proposal"],
    "datasetVersion": "issue-detection-v1",
    "kind": "QUALITY",
    "synthetic": true
  },
  "input": {
    "outputType": "PROPOSAL",
    "projectContext": "가상의 주민 워크숍 제안서",
    "sectionContext": "예산과 실행 계획",
    "labels": ["예산", "일정"],
    "opinions": [
      { "id": "opinion-a", "content": "강사비와 재료비 항목을 분리해 작성하자.", "submitted": true, "deleted": false },
      { "id": "opinion-b", "content": "행사는 토요일 오전에 진행하자.", "submitted": true, "deleted": false }
    ],
    "parentConfirmedContent": null
  },
  "expected": {
    "requiredFacts": [],
    "expectedIssues": [
      { "type": "GAP", "evidenceIds": ["opinion-a"] }
    ],
    "expectedEvidenceIds": ["opinion-a"],
    "forbiddenClaims": ["총예산은 500만원"],
    "goldReviewIssueIds": ["review-budget-total-missing"]
  }
}
