{
  "schemaVersion": 1,
  "metadata": {
    "id": "issue-detection/all-agreed-proposal",
    "feature": "ISSUE_DETECTION",
    "description": "제안서의 대상과 기간에 모든 의견이 합의된 합성 시나리오",
    "language": "ko",
    "tags": ["agreement", "proposal"],
    "datasetVersion": "issue-detection-v1",
    "kind": "QUALITY",
    "synthetic": true
  },
  "input": {
    "outputType": "PROPOSAL",
    "projectContext": "가상의 지역 도서관 독서 프로그램 제안서",
    "sectionContext": "프로그램 대상과 운영 기간",
    "labels": ["대상", "기간"],
    "opinions": [
      { "id": "opinion-a", "content": "중학생을 대상으로 8주 동안 운영하자.", "submitted": true, "deleted": false },
      { "id": "opinion-b", "content": "중학생 대상 8주 과정에 동의한다.", "submitted": true, "deleted": false }
    ],
    "parentConfirmedContent": null
  },
  "expected": {
    "requiredFacts": ["중학생", "8주"],
    "expectedIssues": [],
    "expectedEvidenceIds": ["opinion-a", "opinion-b"],
    "forbiddenClaims": ["대학생 대상", "12주 과정"],
    "goldReviewIssueIds": []
  }
}
