{
  "schemaVersion": 1,
  "metadata": {
    "id": "issue-detection/excluded-opinions-proposal",
    "feature": "ISSUE_DETECTION",
    "description": "삭제되거나 제출되지 않은 의견이 근거 allowlist에서 제외되는 시나리오",
    "language": "ko",
    "tags": ["excluded-input", "proposal"],
    "datasetVersion": "issue-detection-v1",
    "kind": "CONTRACT",
    "synthetic": true
  },
  "input": {
    "outputType": "PROPOSAL",
    "projectContext": "가상의 방과후 프로그램 제안",
    "sectionContext": "운영 요일",
    "labels": ["일정"],
    "opinions": [
      { "id": "opinion-active", "content": "화요일에 운영하자.", "submitted": true, "deleted": false },
      { "id": "opinion-draft", "content": "목요일이 좋겠다.", "submitted": false, "deleted": false },
      { "id": "opinion-deleted", "content": "금요일에 운영하자.", "submitted": true, "deleted": true }
    ],
    "parentConfirmedContent": null
  },
  "expected": {
    "requiredFacts": ["화요일"],
    "expectedIssues": [],
    "expectedEvidenceIds": ["opinion-active"],
    "forbiddenClaims": ["목요일", "금요일"],
    "goldReviewIssueIds": []
  }
}
